title,author,year,edition,full_description,level,score
Learn to Program with Minecraft,Craig Richardson,2015,,"“Learn to Program With Minecraft is 297 pages brimming with potential. It’s an excellent guide for Minecraft players wanting to expand their capabilities in the game and with programming. Highly recommended.""
—GeekDad
“Learn to Program with Minecraft offers an incredibly user-friendly, intuitive, and innovative approach for learning the Python programming language.”
—EE Times


Download Chapter 1: Setting Up for Your Adventure
Download Chapter 7: Dance Parties and Flower Parades with while Loops
Download the setup files for Windows (Minecraft Tools.zip)

Download the setup files for Mac OS (Minecraft Tools Mac.zip)
Download the code used in the book and solutions to the Minecraft Missions
Troubleshooting



You’ve bested creepers, traveled deep into caves, and maybe even gone to The End and back—but have you ever transformed a sword into a magic wand? Built a palace in the blink of an eye? Designed your own color-changing disco dance floor? 
In Learn to Program with Minecraft®, you’ll do all this and more with the power of Python, a free language used by millions of professional and first-time programmers!
Begin with some short, simple Python lessons and then use your new skills to modify Minecraft to produce instant and totally awesome results. Learn how to customize Minecraft to make mini-games, duplicate entire buildings, and turn boring blocks into gold. 
You’ll also write programs that:

Take you on an automated teleportation tour around your Minecraft world
Build massive monuments, pyramids, forests, and more in a snap!
Make secret passageways that open when you activate a hidden switch
Create a spooky ghost town that vanishes and reappears elsewhere
Show exactly where to dig for rare blocks
Cast a spell so that a cascade of flowers (or dynamite if you’re daring!) follows your every move
Make mischief with dastardly lava traps and watery curses that cause huge floods

Whether you’re a Minecraft megafan or a newbie, you’ll see Minecraft in a whole new light while learning the basics of programming. Sure, you could spend all day mining for precious resources or building your mansion by hand, but with the power of Python, those days are over!

Requires: Minecraft Java Edition; Windows 7 or later; OS X 10.10 or later; or a Raspberry Pi.
Click here for details about system requirements.

Uses Python 3
",Beginner,0.67
Make Python Talk,Mark Liu,2021,,"Download Chapter 5: SPEAKING APPLICATIONS
Click here to download the code files used in the book.
Click here to visit the book's github repository to download code and access errata reports.
This fun, hands-on book will take your basic Python skills to the next level as you build voice-controlled apps to use in your daily life. Starting with a Python refresher and an introduction to speech-recognition/text-to-speech functionalities, you’ll soon ease into more advanced topics, like making your own modules and building working voice-controlled apps.
Each chapter scaffolds multiple projects that allow you to see real results from your code at a manageable pace, while end-of-chapter exercises strengthen your understanding of new concepts. You’ll design interactive games, like Connect Four and Tic-Tac-Toe, and create intelligent computer opponents that talk and take commands; you’ll make a real-time language translator, and create voice-activated financial-market apps that track the stocks or cryptocurrencies you are interested in. Finally, you’ll load all of these features into the ultimate virtual personal assistant – a conversational VPA that tells jokes, reads the news, and gives you hands-free control of your email, browser, music player, desktop files, and more.
Along the way, you’ll learn how to:

Build Python modules, implement animations, and integrate live data into an app
Use web-scraping skills for voice-controlling podcasts, videos, and web searches
Fine-tune the speech recognition to accept a variety of input
Associate regular tasks like opening files and accessing the web with speech commands
Integrate functionality from other programs into a single VPA with computational knowledge engines to answer almost any question

Packed with cross-platform code examples to download, practice activities and exercises, and explainer images, you’ll quickly become proficient in Python coding in general and speech recognition/text to speech in particular.
",Beginner,0.64
Math Adventures with Python,Peter Farrell,2019,,"Download Chapter 5: Transforming Shapes with Geometry
Download the code.
Download solutions to exercises.
Math Adventures with Python will show you how to harness the power of programming to keep math relevant and fun. With the aid of the Python programming language, you’ll learn how to visualize solutions to a range of math problems as you use code to explore key mathematical concepts like algebra, trigonometry, matrices, and cellular automata.
Once you’ve learned the programming basics like loops and variables, you’ll write your own programs to solve equations quickly, make cool things like an interactive rainbow grid, and automate tedious tasks like factoring numbers and finding square roots. You’ll learn how to write functions to draw and manipulate shapes, create oscillating sine waves, and solve equations graphically. 
You’ll also learn how to: 

Draw and transform 2D and 3D graphics with matrices
Make colorful designs like the Mandelbrot and Julia sets with complex numbers
Use recursion to create fractals like the Koch snowflake and the Sierpinski triangle
Generate virtual sheep that graze on grass and multiply autonomously
Crack secret codes using genetic algorithms


As you work through the book’s numerous examples and increasingly challenging exercises, you’ll code your own solutions, create beautiful visualizations, and see just how much more fun math can be!
",Intermediate,0.41
Mission Python,Sean McManus,2018,,"Download Chapter 1: Your First Spacewalk
Download the full code, images, and sound effects for the game here
Click here for a list of errata and updates (author site)
Launch into coding with Mission Python, a space-themed guide to building a complete computer game in Python. You'll learn programming fundamentals like loops, strings, and lists as you build Escape!, an exciting game with a map to explore, items to collect, and tricky logic puzzles to solve. As you work through the book, you'll build exercises and mini-projects, like making a spacewalk simulator and creating an astronaut's safety checklist that will put your new Python skills to the test. 
You'll learn how to use Pygame Zero, a free resource that lets you add graphics and sound effects to your creations, and you'll get useful game-making tips, such as how to design fun puzzles and intriguing maps. Before you know it, you'll have a working, awesome game to stump your friends with (and some nifty coding skills, too!). You can follow this book using a Raspberry Pi or a Microsoft Windows PC, and the 3D graphics and sound effects you need are provided as a download.
 
Take a look inside!






",Beginner,0.67
Modeling and Simulation in Python,Allen B. Downey,2023,,"Download Chapter 11: EPIDEMIOLOGY AND SIR MODELS
Look Inside!


Modeling and Simulation in Python is a thorough but easy-to-follow introduction to physical modeling—that is, the art of describing and simulating real-world systems. 
Readers are guided through modeling things like world population growth, infectious disease, bungee jumping, baseball flight trajectories, celestial mechanics, and more while simultaneously developing a strong understanding of fundamental programming concepts like loops, vectors, and functions.
Clear and concise, with a focus on learning by doing, the author spares the reader abstract, theoretical complexities and gets right to hands-on examples that show how to produce useful models and simulations.
",Beginner,0.65
Natural Language Processing with Python and spaCy,Yuli Vasiliev,2020,,"Look Inside!




Download Chapter 2: The Text-Processing Pipeline (PDF)
Download the source code from GitHub


Natural Language Processing with Python and spaCy will show you how to create NLP applications like chatbots, text-condensing scripts, and order-processing tools quickly and easily. You’ll learn how to leverage the spaCy library to extract meaning from text intelligently; how to determine the relationships between words in a sentence (syntactic dependency parsing); identify nouns, verbs, and other parts of speech (part-of-speech tagging); and sort proper nouns into categories like people, organizations, and locations (named entity recognizing). You’ll even learn how to transform statements into questions to keep a conversation going.
You’ll also learn how to: 

 Work with word vectors to mathematically find words with similar meanings (Chapter 5)
 Identify patterns within data using spaCy's built-in displaCy visualizer (Chapter 7)
 Automatically extract keywords from user input and store them in a relational database (Chapter 9)
 Deploy a chatbot app to interact with users over the internet (Chapter 11)


“Try This” sections in each chapter encourage you to practice what you’ve learned by expanding the book’s example scripts to handle a wider range of inputs, add error handling, and build professional-quality applications.
By the end of the book, you’ll be creating your own NLP applications with Python and spaCy.

Check out this video where the author discusses how to extract chatbot user input with Python and spaCy.

",Beginner,0.62
Object-Oriented Python,Irv Kalb,2021,,"Look Inside!
 

Download Chapter 2: MODELING PHYSICAL OBJECTS...

Click here to download the book's code and resources.
Click here to visit the book's github repository.
 Object-Oriented Programming (OOP) is a paradigm that combines data and code into cohesive units, allowing you to think differently about computational problems and solve them in a highly reusable way. Aimed at intermediate-level programmers, Object-Oriented Python is a hands-on tutorial that goes deep into the core tenets of OOP, showing you how to use encapsulation, polymorphism, and inheritance to write games and apps using Python.
The book begins by demonstrating key problems inherent in procedural programming, then guides you through the basics of creating classes and objects in Python. You’ll build on this groundwork by developing buttons, text fields, and other GUI elements that are standard in event-driven environments. You’ll also use many real-world code examples and two pygame-based packages to help turn theory into practice, enabling you to easily write interactive games and applications complete with GUI widgets, animations, multiple scenes, and reusable game logic. In the final chapter, you’ll bring it all together by building a fully functional video game that incorporates many of the OOP techniques and GUI elements covered in the book.
You’ll learn how to:

Create and manage multiple objects using an object manager object
Use encapsulation to hide the inner details of objects from client code
Use polymorphism to define one interface and implement it in multiple classes
Apply inheritance to build on existing code

Object-Oriented Python is a visual, intuitive guide to fully understanding how OOP operates and how you can use it to make your code more maintainable, readable, and efficient—without sacrificing functionality.
",Intermediate,0.71
Practical Deep Learning,Ronald T. Kneusel,2021,,"Look Inside!
   
Download Chapter 4: WORKING WITH DATA
You can find the book's code files and latest updates on GitHub. 
If you’ve been curious about artificial intelligence and machine learning but didn’t know where to start, this is the book you’ve been waiting for. Focusing on the subfield of machine learning known as deep learning, it explains core concepts and gives you the foundation you need to start building your own models. Rather than simply outlining recipes for using existing toolkits, Practical Deep Learning teaches you the why of deep learning and will inspire you to explore further.
All you need is basic familiarity with computer programming and high school math—the book will cover the rest. After an introduction to Python, you’ll move through key topics like how to build a good training dataset, work with the scikit-learn and Keras libraries, and evaluate your models’ performance.
You’ll also learn:

How to use classic machine learning models like k-Nearest Neighbors, Random Forests, and Support Vector Machines
How neural networks work and how they’re trained
How to use convolutional neural networks
How to develop a successful deep learning model from scratch

You’ll conduct experiments along the way, building to a final case study that incorporates everything you’ve learned. All of the code you’ll use is available here: https://github.com/rkneusel9/PracticalDeepLearningPython/
The perfect introduction to this dynamic, ever-expanding field, Practical Deep Learning will give you the skills and confidence to dive into your own machine learning projects.
",Beginner,0.65
Python Crash Course,Eric Matthes,2022,3rd Edition,"Read a Q&A with Eric Matthes
Download Chapter 2: VARIABLES AND SIMPLE DATA TYPES
Look Inside!
 
Python Crash Course is the world’s best-selling guide to the Python programming language. This fast-paced, thorough introduction will have you writing programs, solving problems, and developing functioning applications in no time.
You’ll start by learning basic programming concepts, such as variables, lists, classes, and loops, and practice writing clean code with exercises for each topic. You’ll also learn how to make your programs interactive and test your code safely before adding it to a project. You’ll put your new knowledge into practice by creating a Space Invaders–inspired arcade game, building a set of data visualizations with Python’s handy libraries, and deploying a simple application online.
As you work through the book, you’ll learn how to:

Use powerful Python libraries and tools, including pytest, Pygame, Matplotlib, Plotly, and Django
Make increasingly complex 2D games that respond to keypresses and mouse clicks
Generate interactive data visualizations using a variety of datasets
Build apps that allow users to create accounts and manage their own data, and deploy your apps online
Troubleshoot coding errors and solve common programming problems

New to this edition: This third edition is completely revised to reflect the latest in Python code. New and updated coverage includes VS Code for text editing, the pathlib module for file handling, pytest for testing your code, as well as the latest features of Matplotlib, Plotly, and Django.
If you’ve been thinking about digging into programming, Python Crash Course will provide you with the skills to write real programs fast. Why wait any longer? Start your engines and code!
 
",Beginner,0.68
Python Flash Cards,Eric Matthes,2019,,"
Look Inside!



Featured on ElectronicsWeekly.com.
Keep your coding skills sharp on the go! Python Flash Cards take a tried-and-tested method and give it a programming makeover. Eric Matthes, author of the best-selling Python Crash Course, distills essential Python programming knowledge into this 101-card deck you can use anywhere.
Work through the deck in order or shuffle it up for a new study session every time. You can brush up foundational programming principles and vocabulary like data structures, logical control, and program flow, quiz yourself on Python syntax, and test your skills against exercises and challenges designed to keep you on your toes — all in one sitting.
Don't let your Python training stop at the keyboard. With Python Flash Cards, the power of Python fits in your pocket.
",Beginner,0.64
Python for Data Science,Yuli Vasiliev,2022,,"Look Inside!


Download Chapter 9: ANALYZING LOCATION DATA
 
Python is an ideal choice for accessing, manipulating, and gaining insights from data of all kinds. Python for Data Science introduces you to the Pythonic world of data analysis with a learn-by-doing approach rooted in practical examples and hands-on activities. You’ll learn how to write Python code to obtain, transform, and analyze data, practicing state-of-the-art data processing techniques for use cases in business management, marketing, and decision support.
You will discover Python’s rich set of built-in data structures for basic operations, as well as its robust ecosystem of open-source libraries for data science, including NumPy, pandas, scikit-learn, matplotlib, and more. Examples show how to load data in various formats, how to streamline, group, and aggregate data sets, and how to create charts, maps, and other visualizations. Later chapters go in-depth with demonstrations of real-world data applications, including using location data to power a taxi service, market basket analysis to identify items commonly purchased together, and machine learning to predict stock prices.
",Beginner,0.7
Python for Excel Power Users,Tracy Stephens,2025,,"Excel is a mainstay of the modern workplace, but it isn’t always the best tool for the job. Python for Excel Power Users offers a better way, showing how Python and other coding tools can boost your productivity by streamlining your workflow. Even if you’re inexperienced at programming, you are not starting from scratch—this book leverages what you already know in Excel to introduce you to useful Python concepts that will have you up and coding in no time. Beyond Python, you’ll learn skills such as:

Managing and querying database data using SQL
Obtaining data from external sources through API calls
Developing basic web pages with HTML
Creating attractive dashboards and reports with Dash
Collaborating with others and tracking how projects evolve using Git

Practical examples illustrate how your new coding skills can be immediately applied to your day-to-day work. You’ll be amazed at how much more you can do once you escape the confines of the spreadsheet and replace Excel in your workflow.
",Intermediate,0.44
Python for Kids,Jason R. Briggs,2022,2nd Edition,"Download Chapter 8: HOW TO USE CLASSES AND OBJECTS
Look Inside!

Python is a powerful programming language that’s easy to learn and fun to use! But books about programming in Python can be dull and that’s no fun for anyone.
Python for Kids brings kids (and their parents) into the wonderful world of programming. Jason R. Briggs guides you through the basics, experimenting with unique (and hilarious) example programs featuring ravenous monsters, secret agents, thieving ravens, and more. New terms are defined; code is colored and explained; puzzles stretch the brain and strengthen understanding; and full-color illustrations keep you engaged throughout. 
By the end of the book, you’ll have programmed two games: a clone of the famous Pong, and “Mr. Stick Man Races for the Exit”—a platform game with jumps and animation.
This second edition is revised and updated to reflect Python 3 programming practices. There are new puzzles to inspire you and two new appendices to guide you through Python’s built-in modules and troubleshooting your code.
As you strike out on your programming adventure, you’ll learn how to:

Use fundamental data structures like lists, tuples, and dictionaries  
Organize and reuse your code with functions and modules
Use control structures like loops and conditional statements 
Draw shapes and patterns with Python’s turtle module
Create games, animations, and other graphical wonders with tkinter

Why should serious adults have all the fun? Python for Kids is your ticket into the amazing world of computer programming.
Covers Python 3.x which runs on Windows, macOS, Linux, even Raspberry Pi
",Beginner,0.64
Python One-Liners,Christian Mayer,2020,,"Look Inside!





Download Chapter 2: PYTHON TRICKS (PDF)
Download Python One-Liners cheat sheets (PDF)
Please visit the book's companion site for cheat sheets and video tutorials.
Download executable files here.


Python One-Liners will teach you how to read and write “one-liners”: concise statements of useful functionality packed into a single line of code. You'll learn how to systematically unpack and understand any line of Python code, and write eloquent, powerfully compressed Python like an expert. 
The book’s five chapters cover tips and tricks, regular expressions, machine learning, core data science topics, and useful algorithms. Detailed explanations of one-liners introduce key computer science concepts and boost your coding and analytical skills.
You'll learn about advanced Python features such as list comprehension, slicing, lambda functions, regular expressions, map and reduce functions, and slice assignments.
You’ll also learn how to:

 Leverage data structures to solve real-world problems, like using Boolean indexing to find cities with above-average pollution
 Use NumPy basics such as array, shape, axis, type, broadcasting, advanced indexing, slicing, sorting, searching, aggregating, and statistics
 Calculate basic statistics of multidimensional data arrays and the K-Means algorithms for unsupervised learning
 Create more advanced regular expressions using grouping and named groups, negative lookaheads, escaped characters, whitespaces, character sets (and negative characters sets), and greedy/nongreedy operators
 Understand a wide range of computer science topics, including anagrams, palindromes, supersets, permutations, factorials, prime numbers, Fibonacci numbers, obfuscation, searching, and algorithmic sorting

By the end of the book, you’ll know how to write Python at its most refined, and create concise, beautiful pieces of ""Python art"" in merely a single line.
",Intermediate,0.45
Python Playground,Mahesh Venkitachalam,2023,2nd Edition,"Download Chapter 1: THE KOCH SNOWFL AKE
Look Inside!

Harness the power of Python as you turn code into tangible creations with Python Playground, a collection of 15 inventive projects that will expand your programming horizons, spark your curiosity, and elevate your coding skills.
Go beyond the basics as you write programs to generate art and music, simulate real-world phenomena, and interact with hardware, all through the use of Python and common libraries such as numpy, matplotlib, and Pillow.
As you work through the book’s projects, you will:

Craft intricate Spirograph-like designs with parametric equations and the turtle module
Generate music by synthesizing plucked string sounds
Transform everyday images into ASCII art, photomosaics, and eye-popping autostereograms
Design engaging cellular automata and flocking simulations
Explore the realm of 3D graphics, from basic shape rendering to visualizing MRI scan data
Build a Raspberry Pi–powered laser show that dances along with music

New to this edition: We’ve expanded your playground with five new projects: you’ll draw fractals, bring Conway’s Game of Life into 3D space, and use a Raspberry Pi and Python to create a musical instrument, an IoT garden monitor, and even a machine learning–driven speech recognition system.
Whether you’re a seasoned professional or just getting started, you’ll find Python Playground to be a great way to learn, experiment with, and master this versatile programming language.
",Intermediate,0.46
Python Tools for Scientists,Lee Vaughan,2022,,"Download Chapter 16: THE INFOVIS, SCIVIS, AND DASHBOARDING LIBRARIES
Look Inside!


Python Tools for Scientists will introduce you to Python tools you can use in your scientific research, including Anaconda, Spyder, Jupyter Notebooks, JupyterLab, and numerous Python libraries. You’ll learn to use Python for tasks such as creating visualizations, representing geospatial information, simulating natural events, and manipulating numerical data.
Once you’ve built an optimal programming environment with Anaconda, you’ll learn how to organize your projects and use interpreters, text editors, notebooks, and development environments to work with your code. Following the book’s fast-paced Python primer, you’ll tour a range of scientific tools and libraries like scikit-learn and seaborn that you can use to manipulate and visualize your data, or analyze it with machine learning algorithms.
You’ll also learn how to:

Create isolated projects in virtual environments, build interactive notebooks, test code in the Qt console, and use Spyder’s interactive development features
Use Python’s built-in data types, write custom functions and classes, and document your code
Represent data with the essential NumPy, Matplotlib, and pandas libraries
Use Python plotting libraries like Plotly, HoloViews, and Datashader to handle large datasets and create 3D visualizations

Regardless of your scientific field, Python Tools for Scientists will show you how to choose the best tools to meet your research and computational analysis needs.
",Beginner,0.6
